title,description,company,location,area,date,image
"Designer, television/film set","Nulla corporis laboriosam distinctio eaque aperiam. Harum debitis itaque voluptas. In cumque sunt assumenda.
Dicta perferendis recusandae dolorum nesciunt nemo totam. Excepturi explicabo deleniti perferendis excepturi ullam ex expedita.",Compañía Nacional de Tecnología,Cali,Desarrollo,2024-01-21,vacante/images/default.jpeg
Electrical engineer,Natus debitis accusamus optio saepe adipisci odio. Perferendis dolor quos sapiente nisi cumque necessitatibus. Similique culpa sequi consectetur eius possimus consequatur. Nostrum corporis quidem cumque cum a.,Soluciones Financieras Ltda.,Cali,Desarrollo,2020-09-30,vacante/images/default.jpeg
Field seismologist,Magni sapiente necessitatibus blanditiis ullam numquam vitae. Recusandae soluta rerum impedit ea. Voluptatum alias non ipsa.,Proyectos Empresariales,Cúcuta,Recursos Humanos,2021-10-25,vacante/images/default.jpeg
Minerals surveyor,"In vero modi architecto quia. Reprehenderit eius odio deleniti sequi iste. At modi totam accusamus maxime.
Totam nostrum mollitia incidunt at at. Earum dolore totam nihil voluptatem facilis quo. Id nulla hic aperiam.",Estrategias de Marketing Digital,Ibagué,Desarrollo,2021-09-21,vacante/images/default.jpeg
Jewellery designer,Et omnis veniam delectus rem cupiditate. Similique magnam voluptate voluptatibus eos dolorem. Reiciendis provident sed amet illo iure neque. Quam a labore.,Proyectos Empresariales,Medellín,Ventas,2023-03-08,vacante/images/default.jpeg
"Therapist, music",Explicabo a magnam ea officia culpa modi. Maiores omnis maiores repellendus error expedita illo dolorum. Officiis nisi eos quia quos temporibus architecto.,Estrategias de Marketing Digital,Barranquilla,Diseño,2024-03-19,vacante/images/default.jpeg
Management consultant,Recusandae dignissimos minus dolorem. Consectetur asperiores impedit at impedit cum consequatur voluptatem. Reiciendis quibusdam optio.,Estrategias de Marketing Digital,Cali,Ventas,2021-12-28,vacante/images/default.jpeg
Textile designer,Voluptatibus eum nesciunt quo suscipit. Doloribus odit sunt. Ad tenetur cumque magnam similique sunt omnis.,Estrategias de Marketing Digital,Manizales,Administración,2023-09-26,vacante/images/default.jpeg
"Designer, blown glass/stained glass","Accusantium explicabo delectus sed officia. Non pariatur eum veniam amet dolor quasi.
Aperiam ex omnis eos. Dolorem dolore laboriosam eos officia distinctio delectus.",Corporación Innovadora,Pasto,Marketing,2025-01-22,vacante/images/default.jpeg
Social researcher,"Vero asperiores ut perspiciatis magni. Aliquam perferendis assumenda blanditiis ipsam quod provident quibusdam. Quod nulla fugiat ipsam sapiente.
Voluptatibus non ea amet libero. Facilis fuga iusto voluptate. Facilis quidem fugit.",Fábrica de Software Internacional,Cúcuta,Administración,2024-08-10,vacante/images/default.jpeg
"Engineer, energy","Quas autem quisquam. Ut perferendis delectus quis inventore eius. Iure dolorem ex perspiciatis nisi facilis.
Tempore omnis doloremque velit sint. Officiis dicta asperiores magni sunt numquam totam. Magni quasi modi fuga.",Proyectos Empresariales,Pereira,Investigación,2020-01-23,vacante/images/default.jpeg
Ambulance person,Reprehenderit esse nemo nostrum officiis deleniti. Delectus dignissimos reiciendis porro dignissimos aspernatur soluta autem. Mollitia maiores maxime facere est.,Fábrica de Software Internacional,Medellín,Diseño,2022-05-25,vacante/images/default.jpeg
Youth worker,"Accusantium nulla eos voluptatibus.
Incidunt fugiat beatae molestias. Magnam quibusdam nulla quae.
Nam labore iure ipsa illo dolore. Reiciendis possimus porro quisquam.
Rem earum veritatis. In repudiandae veniam architecto.",Compañía Nacional de Tecnología,Cartagena,Administración,2020-02-15,vacante/images/default.jpeg
Hydrogeologist,"Maiores animi quasi dolorem doloremque. Aliquam explicabo iusto alias. Fugiat qui illo pariatur.
Rerum earum aliquid harum recusandae itaque dolor. Voluptate alias aspernatur voluptate distinctio sapiente.",Corporación Innovadora,Bucaramanga,Ventas,2022-12-18,vacante/images/default.jpeg
Oncologist,Eveniet labore fugiat vitae quidem enim soluta. Facilis eveniet officiis ullam. Eligendi soluta praesentium voluptatem qui laudantium voluptatibus cupiditate.,Fábrica de Software Internacional,Cúcuta,Desarrollo,2023-07-03,vacante/images/default.jpeg
Higher education lecturer,"Reiciendis eius ex quis assumenda.
Minus aliquam sint dignissimos.
Minima voluptate debitis suscipit.
Dolorem ad veritatis. Dolores non veritatis enim doloremque cum quisquam. Quibusdam consequatur deserunt odio molestiae dignissimos.",Fábrica de Software Internacional,Armenia,Desarrollo,2022-05-05,vacante/images/default.jpeg
"Therapist, art","Architecto dicta porro et nobis magni. Harum quia ab culpa dolores. Nulla deleniti ut culpa.
Beatae voluptas rerum. Suscipit repellendus deleniti tempora officia cumque. Voluptates impedit ex aliquam velit vel veniam nostrum.",Corporación Innovadora,Neiva,Recursos Humanos,2024-12-18,vacante/images/default.jpeg
Community education officer,"Sapiente pariatur at sequi dolorem officiis iure. Quo nemo facilis aut.
Illum hic veniam dolore. Reprehenderit quasi tenetur eveniet pariatur eaque molestias. Occaecati perferendis ad odit occaecati exercitationem.",Proyectos Empresariales,Pasto,Marketing,2025-03-24,vacante/images/default.jpeg
"Production designer, theatre/television/film","Dolores at consequatur dolor. Sit voluptatem aperiam quae eveniet cupiditate dicta.
Consequuntur quas sunt error quidem officiis ipsam. Necessitatibus sunt porro in.",Corporación Innovadora,Pasto,Administración,2024-08-30,vacante/images/default.jpeg
Television production assistant,"Laudantium nobis quaerat dolores quo tenetur. Quidem illum sed autem consequuntur consequatur. Libero praesentium laborum.
Dignissimos mollitia quibusdam ipsa quia. Nostrum unde voluptatibus optio veritatis.",Compañía Nacional de Tecnología,Bucaramanga,Recursos Humanos,2022-08-30,vacante/images/default.jpeg
"Lecturer, further education","Eaque cupiditate maiores culpa. Molestiae cupiditate minima est. Eos illo voluptatibus sint sunt eaque. Laudantium quibusdam repellat repudiandae.
Repudiandae praesentium dolor sunt. Hic id odio tempora dolores.
Enim soluta iure assumenda dolor.",Sistemas Digitales S.A.,Manizales,Recursos Humanos,2021-06-03,vacante/images/default.jpeg
Mental health nurse,"Expedita ab vel cum aut rerum. Incidunt fuga accusantium adipisci ea.
Iste aperiam possimus officia quidem expedita. Sequi aliquam itaque laboriosam libero.
Adipisci voluptatem adipisci quia quia. Reprehenderit rerum quo qui.",Grupo Empresarial Latinoamericano,Neiva,Recursos Humanos,2023-04-17,vacante/images/default.jpeg
Mechanical engineer,Voluptates provident porro ea blanditiis. Laudantium fugit soluta numquam repellat reprehenderit suscipit. Iste voluptates amet.,Proyectos Empresariales,Bogotá,Soporte Técnico,2023-01-04,vacante/images/default.jpeg
"Designer, furniture","Fuga ducimus numquam dolor beatae. Quaerat hic eius eius quaerat labore voluptatem.
Natus nemo sit itaque cupiditate. Harum qui omnis distinctio neque. Voluptatem aliquid sunt qui unde ut laudantium architecto.",Soluciones Financieras Ltda.,Bucaramanga,Recursos Humanos,2021-10-10,vacante/images/default.jpeg
"Psychotherapist, dance movement","Nostrum autem officia perspiciatis soluta. Autem ab magnam odio quas ratione quas. Quibusdam debitis sint pariatur minima.
Et iusto delectus molestiae. Alias maiores commodi quos ipsa exercitationem.",Soluciones Financieras Ltda.,Pasto,Administración,2020-03-07,vacante/images/default.jpeg
"Pharmacist, community",Autem repellat laudantium dicta incidunt consectetur fugiat harum. Alias rem dolores nihil labore nobis doloribus occaecati.,Corporación Innovadora,Bogotá,Contabilidad,2024-01-31,vacante/images/default.jpeg
Quarry manager,"Repudiandae officia distinctio rem. Ipsam temporibus autem minus.
Placeat laborum aspernatur ab. Quo enim excepturi aliquid fugit blanditiis.",Proyectos Empresariales,Manizales,Desarrollo,2024-03-07,vacante/images/default.jpeg
Rural practice surveyor,"Inventore est dolor nobis dolorum modi. Asperiores necessitatibus consequatur quis quae inventore qui.
Odit quos animi tenetur ea. Aliquam explicabo sapiente accusantium corporis incidunt.",Grupo Empresarial Latinoamericano,Cúcuta,Diseño,2023-01-08,vacante/images/default.jpeg
"Psychologist, prison and probation services","Ea quia iure. Quia nesciunt velit ad error. Amet eum dolores.
Fugiat inventore modi delectus omnis magnam. Voluptas vero provident labore nesciunt voluptatum nemo. Eius eum quae accusantium.",Compañía Nacional de Tecnología,Bucaramanga,Consultoría,2020-12-29,vacante/images/default.jpeg
Office manager,"Nemo quisquam qui possimus. Facere assumenda sint illo perspiciatis atque earum. Voluptates beatae officiis.
Veritatis numquam quaerat optio ipsam cumque nisi. Nam aut unde omnis magnam.",Soluciones Financieras Ltda.,Cúcuta,Recursos Humanos,2024-05-20,vacante/images/default.jpeg
Community arts worker,"Accusantium possimus beatae ullam occaecati consequatur quas. Rerum rem tempore.
Animi et corporis nobis sit quaerat fuga. Error molestiae minima pariatur eveniet voluptatibus atque labore.",Estrategias de Marketing Digital,Barranquilla,Diseño,2024-06-06,vacante/images/default.jpeg
"Programme researcher, broadcasting/film/video","Minus quibusdam harum. Ut dolore quia ullam.
Nesciunt exercitationem commodi maxime sit quibusdam. Nobis ipsum nulla.",Consultores Globales,Barranquilla,Soporte Técnico,2023-03-22,vacante/images/default.jpeg
"Engineer, manufacturing","Necessitatibus vitae corrupti nobis eos iure dolorum. Aliquid tempore harum cumque ad officia.
Delectus accusantium aperiam ducimus mollitia. Maxime aliquam dicta facilis.",Sistemas Digitales S.A.,Cartagena,Recursos Humanos,2024-01-28,vacante/images/default.jpeg
Counsellor,"Odio quam ut est natus est.
Blanditiis ab voluptatum nostrum maiores. Id dolorem unde praesentium perspiciatis praesentium esse.",Proyectos Empresariales,Cartagena,Administración,2024-03-04,vacante/images/default.jpeg
"Education officer, community","Id odit illo veniam facilis consequatur.
Laboriosam magnam ex provident. Tempore facilis ratione reiciendis nam quos optio. Animi vitae temporibus eum ipsa iusto aliquid.
Debitis inventore incidunt animi eligendi.",Consultores Globales,Ibagué,Soporte Técnico,2020-11-26,vacante/images/default.jpeg
Energy manager,"Consectetur dicta quibusdam veniam natus. Vel adipisci illo placeat maxime corrupti.
Laudantium dicta iure. Distinctio iste ut sed aut laborum. Neque maiores quo.",Fábrica de Software Internacional,Bogotá,Investigación,2021-09-08,vacante/images/default.jpeg
"Engineer, site","Dignissimos deserunt distinctio alias ipsum nihil. Laudantium quis voluptatibus ipsa eligendi aperiam.
Tempora repellendus exercitationem a suscipit porro. Atque rerum placeat dignissimos velit ad quidem.",Fábrica de Software Internacional,Armenia,Investigación,2021-07-22,vacante/images/default.jpeg
"Designer, jewellery","Maiores harum ducimus aliquam corrupti voluptatem.
Aliquid id iusto doloremque aliquam. Quae mollitia ab nisi id similique vel. Vel iste atque corrupti impedit id saepe.",Proyectos Empresariales,Santa Marta,Recursos Humanos,2023-09-11,vacante/images/default.jpeg
Bonds trader,Vitae atque ex nam labore voluptates. Eaque ad vero odio natus illo quo. Dolores molestiae quia voluptates explicabo sint voluptatem.,Compañía Nacional de Tecnología,Pereira,Investigación,2023-08-03,vacante/images/default.jpeg
Charity officer,"Ad culpa ipsa voluptate. Officiis rem saepe libero veritatis suscipit.
Eaque modi quo esse voluptatum. A dolorum unde itaque aperiam occaecati. Neque nisi cumque incidunt iste.
Distinctio impedit nulla iure. Placeat inventore excepturi nisi.",Servicios de Infraestructura TIC,Villavicencio,Marketing,2022-07-30,vacante/images/default.jpeg
Maintenance engineer,Labore pariatur minus voluptatibus perspiciatis. Incidunt architecto nemo nisi velit delectus. Sequi et ab maiores debitis eos ullam.,Compañía Nacional de Tecnología,Bogotá,Soporte Técnico,2025-01-22,vacante/images/default.jpeg
Sports development officer,"Sint tempore aperiam deleniti. Aliquid eligendi numquam laudantium minus ipsam. Quae libero magnam quae.
Nemo quibusdam eos repudiandae iure. Harum possimus molestiae tempore tempore perferendis expedita. Facere vel saepe quas.",Consultores Globales,Santa Marta,Recursos Humanos,2023-08-29,vacante/images/default.jpeg
Chartered public finance accountant,"Fuga quasi occaecati hic at ducimus. Dolorem magni excepturi quasi praesentium. Natus ea eum quos facere repellat adipisci sed.
Minus nemo iure eius. Exercitationem fugit ab ad. At beatae commodi illum voluptatem.",Servicios de Infraestructura TIC,Cali,Desarrollo,2022-11-07,vacante/images/default.jpeg
Adult nurse,"Facere iusto quos in. Tempora placeat soluta. Minima veniam tenetur sequi voluptas libero.
Velit eius molestiae non hic cum. Doloribus officiis corporis. Debitis animi in non nemo voluptatibus distinctio.
Totam laboriosam assumenda nesciunt.",Servicios de Infraestructura TIC,Cartagena,Desarrollo,2023-02-02,vacante/images/default.jpeg
Charity fundraiser,"Quas nihil cupiditate sint similique nulla nam. Inventore minima fuga repellat dolorum eius excepturi sed. Quasi assumenda iure voluptates accusantium debitis dolore.
Nihil similique blanditiis veniam nemo. Accusamus molestias at labore.",Grupo Empresarial Latinoamericano,Medellín,Diseño,2024-09-21,vacante/images/default.jpeg
"Administrator, local government","Repellendus perspiciatis fuga consectetur quaerat eum.
Fuga amet ullam temporibus nesciunt quas quod. Ex rem consectetur. Nesciunt corporis at ut.
Dolores aperiam dolorum numquam nihil. Dolor tenetur nulla unde id reiciendis sequi.",Servicios de Infraestructura TIC,Bogotá,Investigación,2024-05-14,vacante/images/default.jpeg
Camera operator,Quisquam assumenda illum mollitia voluptatem. Quasi iste natus tempora placeat et quibusdam. Deserunt voluptatum sunt ex. Recusandae architecto aspernatur repudiandae.,Grupo Empresarial Latinoamericano,Armenia,Diseño,2024-10-29,vacante/images/default.jpeg
Company secretary,"Nihil fuga eligendi delectus explicabo nesciunt.
A fugit dolores ipsum consequatur. Ipsum deserunt nam molestiae.
Quisquam nulla quod vel. Officiis facere vero ad nulla placeat. Expedita magnam sunt eveniet explicabo.",Estrategias de Marketing Digital,Armenia,Desarrollo,2023-04-02,vacante/images/default.jpeg
"Psychotherapist, child","Ratione maiores fugit assumenda ad. Molestias molestiae magni veritatis quas deserunt rerum molestias.
Quod tenetur laudantium assumenda. Quidem dicta blanditiis tempora nihil. Molestiae tempore autem voluptates.",Soluciones Financieras Ltda.,Medellín,Consultoría,2020-03-06,vacante/images/default.jpeg
Hydrogeologist,"A corporis soluta perspiciatis nulla veniam. Atque nobis delectus id facilis dolore natus. Possimus quis voluptatum.
Quo minima repudiandae adipisci consequatur sapiente eligendi. Provident quos eligendi rerum voluptas quod aliquid.",Corporación Innovadora,Cali,Diseño,2023-03-04,vacante/images/default.jpeg
Patent attorney,"Eum illo earum in. Laudantium alias veniam voluptatem libero incidunt adipisci. Laboriosam repellendus nostrum consequuntur.
Molestias voluptas ipsum iusto asperiores. Assumenda beatae illum aut soluta est mollitia.",Grupo Empresarial Latinoamericano,Barranquilla,Desarrollo,2022-06-08,vacante/images/default.jpeg
"Engineer, drilling","Corrupti sunt tenetur cum repellat facilis dolorem. Ut autem cum officia veritatis laudantium.
Provident cumque minus assumenda atque. Sequi fugit doloremque voluptas enim repellendus. Suscipit labore fugiat ea sit blanditiis.",Grupo Empresarial Latinoamericano,Bogotá,Ventas,2023-05-25,vacante/images/default.jpeg
"Education officer, community","Libero magnam quos vero. Eos in facilis dolorem laboriosam voluptates.
Laboriosam cum eaque delectus. Suscipit laborum culpa quaerat fugiat nam. Occaecati nulla libero vitae asperiores ipsum commodi autem.",Servicios de Infraestructura TIC,Cartagena,Desarrollo,2024-12-16,vacante/images/default.jpeg
Careers information officer,"Optio ut eveniet neque delectus. Sit vel et doloribus. Minima totam illum error.
Quisquam vero rem doloremque ipsam facere officia. Nostrum repudiandae est dignissimos quidem exercitationem amet. Nemo laborum earum harum odio.",Proyectos Empresariales,Cali,Ventas,2022-05-29,vacante/images/default.jpeg
Secretary/administrator,"Tempore ullam repellendus porro repudiandae necessitatibus cupiditate ab. Iste odio maxime blanditiis.
Quas unde nostrum quo minima. Magni a facere in consequatur quibusdam error. Quia molestiae excepturi deleniti.",Soluciones Financieras Ltda.,Bucaramanga,Contabilidad,2020-08-18,vacante/images/default.jpeg
Production manager,Dicta qui omnis sed fugiat vitae. Dignissimos aliquam dicta impedit esse temporibus.,Sistemas Digitales S.A.,Bogotá,Investigación,2023-09-22,vacante/images/default.jpeg
Paediatric nurse,"Necessitatibus illo nesciunt aperiam tempore dignissimos. Adipisci ducimus doloremque reiciendis quas neque.
Dolorum necessitatibus laboriosam a. Dicta mollitia rerum quia. Assumenda hic facere vitae voluptate. Cupiditate et sunt reiciendis libero.",Consultores Globales,Villavicencio,Diseño,2024-05-25,vacante/images/default.jpeg
Ophthalmologist,"Tempora aliquam perferendis voluptates amet porro dolorem dicta. Quis sit non at fugiat.
Ipsum dolores molestiae praesentium. Quaerat facere pariatur cum corporis incidunt. Aliquam exercitationem perspiciatis excepturi sapiente laboriosam dolorem.",Consultores Globales,Pasto,Soporte Técnico,2024-08-13,vacante/images/default.jpeg
Trade mark attorney,"Dolor libero facere soluta. Voluptatum non minima animi. Consequuntur facere quibusdam quo iure.
Repudiandae magnam quis fuga adipisci quos. Provident magnam reiciendis quasi est. Corrupti quam numquam.",Compañía Nacional de Tecnología,Barranquilla,Desarrollo,2021-01-19,vacante/images/default.jpeg
"Programme researcher, broadcasting/film/video","Vero facilis unde fuga. Quisquam harum aut blanditiis. Nostrum aut adipisci quisquam eligendi dolores accusantium ducimus.
Nostrum non unde itaque mollitia ipsam molestias. Pariatur iure architecto illum possimus iure. Sed sapiente cumque cum rem.",Servicios de Infraestructura TIC,Cartagena,Investigación,2025-03-01,vacante/images/default.jpeg
Primary school teacher,"Dolore vel sunt quasi quis. Quibusdam ad impedit quisquam fuga. Error illo nesciunt porro rerum consectetur voluptatum quidem.
Nihil provident vel laudantium. Dolor maxime neque error deserunt libero nemo. Voluptatibus vel eaque alias.",Fábrica de Software Internacional,Ibagué,Recursos Humanos,2021-09-09,vacante/images/default.jpeg
Prison officer,"Quasi vitae in necessitatibus. Dolor debitis exercitationem vel itaque vero.
Fugiat praesentium doloribus velit unde. Optio ratione ullam.",Estrategias de Marketing Digital,Cúcuta,Diseño,2022-04-05,vacante/images/default.jpeg
"Psychologist, occupational",Harum ullam cumque reiciendis esse itaque magni. Excepturi quisquam provident enim non repudiandae. Asperiores maiores error ipsa.,Corporación Innovadora,Bucaramanga,Administración,2021-05-06,vacante/images/default.jpeg
"Engineer, control and instrumentation","Esse suscipit illum deserunt cupiditate. Repellendus non saepe fuga voluptates beatae.
Autem facere sunt doloremque quaerat minus. Vel blanditiis suscipit nulla sit nulla nihil. Sit quisquam placeat eligendi.",Compañía Nacional de Tecnología,Bogotá,Recursos Humanos,2024-09-23,vacante/images/default.jpeg
"Civil engineer, consulting","Sapiente repudiandae pariatur deserunt voluptas quod. Soluta beatae quis blanditiis dolorum quo omnis.
Eveniet blanditiis ipsum laborum.
Recusandae delectus quia quo. Nisi fuga rerum quas sequi necessitatibus.",Soluciones Financieras Ltda.,Manizales,Administración,2022-11-06,vacante/images/default.jpeg
Arts administrator,"Itaque rerum nemo natus libero vel nostrum eos. Doloremque vero quibusdam asperiores sapiente.
Sed nesciunt quod expedita animi. Pariatur minus neque incidunt dicta excepturi voluptatem. In esse ut suscipit impedit ipsum labore.",Soluciones Financieras Ltda.,Bogotá,Soporte Técnico,2022-04-11,vacante/images/default.jpeg
Paramedic,"Omnis occaecati voluptatum inventore libero. Mollitia eos dolores nostrum molestias error distinctio quas.
Pariatur non quia ipsam. Voluptatibus quo totam sapiente. Corporis dicta totam hic iure eveniet ipsam.",Servicios de Infraestructura TIC,Neiva,Diseño,2020-07-15,vacante/images/default.jpeg
Corporate investment banker,"Incidunt doloremque veniam placeat. Eius occaecati quam magnam tenetur aliquam minima. Consequatur autem blanditiis at nulla iure.
Libero dolorem non aliquam atque. Aspernatur vero asperiores ipsam.",Compañía Nacional de Tecnología,Cali,Marketing,2021-01-09,vacante/images/default.jpeg
Chartered management accountant,"Aspernatur ut saepe consequatur similique. Est id magni quos. Inventore placeat minima.
Eveniet neque error voluptas tempora deleniti. Provident quibusdam odit dolorum dicta dolorem asperiores. Delectus necessitatibus corporis necessitatibus.",Corporación Innovadora,Armenia,Consultoría,2020-08-09,vacante/images/default.jpeg
Product manager,"At magni magnam praesentium reiciendis fuga. Soluta officiis reiciendis. Possimus quidem ducimus culpa maiores consequatur.
Tempora totam optio laborum dolore nobis. Fugit maxime omnis dolor earum accusantium culpa sit.",Compañía Nacional de Tecnología,Bogotá,Desarrollo,2021-07-17,vacante/images/default.jpeg
Museum/gallery conservator,"Praesentium ducimus beatae placeat quidem minus. Molestiae quam recusandae aperiam. Facere officiis laudantium minus ducimus harum.
Sapiente laborum tempora dolor harum. Aperiam ipsa error iste veritatis fugit.",Compañía Nacional de Tecnología,Cartagena,Consultoría,2022-03-09,vacante/images/default.jpeg
Editorial assistant,"Maxime praesentium tempore tenetur dolor eveniet cum. Quibusdam debitis et eveniet. Magni ex animi porro aliquam dolor.
Non aliquid optio eaque. Animi incidunt ipsum hic blanditiis dolore. Animi occaecati maxime quae in magni deleniti.",Servicios de Infraestructura TIC,Pasto,Consultoría,2024-08-27,vacante/images/default.jpeg
"Editor, film/video","Accusantium laudantium illum asperiores ipsa. Unde nulla excepturi voluptatem eum aperiam explicabo. Temporibus doloribus provident voluptate vel.
Libero eos eligendi nobis maxime vel quasi. Iure eius ab cum.",Compañía Nacional de Tecnología,Cartagena,Consultoría,2020-01-06,vacante/images/default.jpeg
Psychotherapist,"Voluptatibus nihil sunt temporibus repudiandae a porro voluptatem. Perspiciatis est perferendis id.
Nobis officia voluptate quod laborum. Voluptatem inventore animi cumque voluptas dolore.",Soluciones Financieras Ltda.,Pasto,Ventas,2020-07-24,vacante/images/default.jpeg
Paediatric nurse,"Eligendi animi et quam deserunt aspernatur. Soluta rem ipsam numquam harum numquam illum.
Dolore repudiandae dicta doloremque occaecati. Modi assumenda explicabo pariatur rem. Magnam debitis dolor harum. Reiciendis aperiam aliquam tempore error.",Proyectos Empresariales,Pereira,Soporte Técnico,2024-12-12,vacante/images/default.jpeg
Cartographer,"Iusto saepe harum eaque. Necessitatibus fugiat itaque natus beatae quia.
Minus rem animi excepturi occaecati. Exercitationem culpa voluptatum sint ipsum temporibus. Asperiores beatae ex.",Servicios de Infraestructura TIC,Medellín,Desarrollo,2024-06-16,vacante/images/default.jpeg
Writer,"Illum totam optio rem autem maiores similique. Vero asperiores autem.
Aspernatur at error itaque. Ea doloremque illo laboriosam tempore.",Compañía Nacional de Tecnología,Bucaramanga,Recursos Humanos,2022-08-17,vacante/images/default.jpeg
"Teacher, music","Quod aut perspiciatis iure perspiciatis. Consequatur aliquam sequi esse eos molestiae.
Maiores quae dolorum dolorum. Praesentium reiciendis maiores voluptate dicta. Nihil optio accusamus repudiandae. Beatae nisi magni unde nihil eos occaecati.",Sistemas Digitales S.A.,Neiva,Recursos Humanos,2020-09-16,vacante/images/default.jpeg
Oncologist,"Quasi culpa quidem quas consectetur. Dolor nihil inventore.
Quis nesciunt porro sed a amet assumenda. Distinctio odio distinctio vero.
Iusto sit provident porro accusamus qui omnis. Non reiciendis laborum. Laboriosam modi deleniti rerum.",Soluciones Financieras Ltda.,Pereira,Consultoría,2025-01-28,vacante/images/default.jpeg
"Teacher, English as a foreign language",Nesciunt necessitatibus debitis magnam consequatur quidem. Nesciunt labore perspiciatis labore. Assumenda voluptatum hic officia ipsum tenetur.,Servicios de Infraestructura TIC,Cúcuta,Soporte Técnico,2020-12-02,vacante/images/default.jpeg
Educational psychologist,"Sequi sunt beatae excepturi fugiat. Quo impedit sit. Esse occaecati eum aspernatur beatae voluptatibus.
Quasi quasi deserunt sit nesciunt magnam. Accusantium rem magni autem. Ea consequuntur possimus sapiente veniam laboriosam.",Servicios de Infraestructura TIC,Medellín,Desarrollo,2020-11-12,vacante/images/default.jpeg
Podiatrist,"Odit ducimus exercitationem excepturi ad illum. In fugit eveniet possimus repudiandae nesciunt.
Libero quo omnis vero. Minus aut ipsum rerum. Laboriosam consequuntur laborum sint consequatur nam odio.
Ducimus assumenda asperiores voluptatum.",Sistemas Digitales S.A.,Neiva,Marketing,2022-04-12,vacante/images/default.jpeg
Community arts worker,Quis neque cupiditate corrupti veritatis. Maiores quibusdam officia aliquam repellendus dolores suscipit. Sit vitae dolores optio accusantium nulla odit.,Consultores Globales,Armenia,Consultoría,2020-12-23,vacante/images/default.jpeg
