title,description,company,location,area,date,image
"Engineer, building services","Quidem molestiae deserunt eaque. Sit totam provident ipsum corrupti sapiente et cum. Reprehenderit fuga ex eveniet voluptas nesciunt nihil.
Nobis ex distinctio porro.
Tenetur amet occaecati sit voluptatem excepturi magnam. Quidem sit nam.",Consultores Globales,Ibagué,Investigación,2020-02-08,vacante/images/default.jpeg
Quantity surveyor,"Quisquam facere eum et hic pariatur blanditiis. Totam adipisci deserunt doloremque expedita et. Magni sit illum sit quod minima.
Consequatur ipsum quam dicta fugiat totam rem. Officiis aperiam mollitia inventore quos consequuntur nam delectus.",Grupo Empresarial Latinoamericano,Bogotá,Desarrollo,2023-12-24,vacante/images/default.jpeg
Acupuncturist,"Occaecati doloribus vitae sunt. Officiis inventore repudiandae nobis quisquam quas fuga deleniti.
Tempora optio earum. Aliquam inventore temporibus debitis quis.
Illum tempore error nobis repellendus sint nemo sed.",Servicios de Infraestructura TIC,Medellín,Soporte Técnico,2023-02-01,vacante/images/default.jpeg
Food technologist,"Laboriosam itaque odio. Dignissimos assumenda deserunt autem. Similique quas ad ipsum dolor aliquam.
Voluptatibus voluptatibus atque amet beatae iste. Explicabo voluptates facilis ipsam tenetur nesciunt culpa.",Grupo Empresarial Latinoamericano,Barranquilla,Desarrollo,2024-09-05,vacante/images/default.jpeg
Agricultural consultant,"Maiores magnam voluptatem ipsam perferendis. Voluptates maxime repudiandae reprehenderit.
Saepe suscipit dignissimos ex quidem unde. Perspiciatis illum quasi blanditiis dolore velit. Accusamus nostrum nisi iure sapiente incidunt fugit.",Soluciones Financieras Ltda.,Cali,Ventas,2023-09-01,vacante/images/default.jpeg
"Presenter, broadcasting","Hic incidunt nulla laudantium cumque. Aspernatur tempora adipisci consequuntur dignissimos numquam assumenda.
Aut doloribus nesciunt maiores delectus. Autem exercitationem quia dolore quis aspernatur voluptas.",Consultores Globales,Cúcuta,Administración,2020-08-16,vacante/images/default.jpeg
Corporate treasurer,"Eveniet illo quidem sunt ducimus accusantium. Aspernatur vitae dolor enim modi.
Exercitationem minima et quasi voluptatibus molestias. Vero optio esse quis repudiandae. Aliquid enim quia iusto porro temporibus nostrum fuga.",Soluciones Financieras Ltda.,Santa Marta,Soporte Técnico,2022-10-25,vacante/images/default.jpeg
Armed forces operational officer,"Molestiae iusto iure autem ut iure est. Ipsum officiis optio officia. Voluptatem consectetur esse minima vitae tempora reiciendis. Consequuntur similique libero facere nam.
Sed libero magni officiis dignissimos dicta.",Grupo Empresarial Latinoamericano,Neiva,Administración,2024-05-30,vacante/images/default.jpeg
Clinical cytogeneticist,"Debitis at assumenda accusantium. Corporis possimus veniam illo consequuntur numquam nam ad.
Necessitatibus assumenda rem eaque quia rem iusto. Pariatur voluptatem nemo enim fugit cum.",Compañía Nacional de Tecnología,Neiva,Marketing,2023-11-18,vacante/images/default.jpeg
General practice doctor,Animi exercitationem quo velit eveniet. Similique quibusdam voluptatum quos dignissimos dolor quo. Officiis asperiores commodi natus mollitia sequi.,Consultores Globales,Cartagena,Ventas,2022-10-09,vacante/images/default.jpeg
Horticultural therapist,"Perferendis repellendus ducimus neque blanditiis. Totam fugiat fugiat voluptates et temporibus sequi.
Itaque sapiente voluptate. Fuga nulla asperiores odio.
Non incidunt voluptates iure ullam magni officiis. Corrupti tempore voluptatem deleniti aut.",Servicios de Infraestructura TIC,Pasto,Ventas,2021-10-25,vacante/images/default.jpeg
Trade mark attorney,Fugit eos temporibus accusantium quia fuga. Quibusdam omnis error nesciunt.,Corporación Innovadora,Cartagena,Administración,2020-05-06,vacante/images/default.jpeg
Volunteer coordinator,"Neque ducimus atque vitae enim cumque earum. Quidem praesentium itaque architecto adipisci.
Sit tempore autem quaerat voluptates libero. Qui libero quasi magni odit voluptatem. Rem sed fugiat.",Consultores Globales,Santa Marta,Marketing,2024-03-26,vacante/images/default.jpeg
Chief Operating Officer,"Quis earum unde culpa quasi rerum. Quod porro voluptas modi beatae. Soluta dolor error occaecati adipisci modi.
Fugit similique quas delectus nihil nemo dolorum.
In eum quam fugiat. Consequatur nostrum in beatae corrupti reprehenderit.",Servicios de Infraestructura TIC,Bogotá,Diseño,2021-03-19,vacante/images/default.jpeg
Music therapist,"Provident consectetur labore eaque laudantium eligendi.
Ullam doloribus quis odio harum repellendus.
Quibusdam facere error officia.
Ipsum asperiores debitis. Beatae placeat nemo nostrum iste ullam mollitia nobis.",Grupo Empresarial Latinoamericano,Cartagena,Marketing,2020-01-12,vacante/images/default.jpeg
"Investment banker, corporate",Hic aperiam eaque sed fuga rerum. Asperiores nisi aut culpa assumenda ducimus iusto. Voluptate laborum perspiciatis commodi repudiandae. Commodi provident magni dolorem fugit id.,Corporación Innovadora,Armenia,Marketing,2023-01-01,vacante/images/default.jpeg
"Therapist, drama",Sit sequi provident tempore. Repellat sit necessitatibus expedita natus eveniet sit. Officia praesentium numquam deserunt dolore laborum.,Proyectos Empresariales,Bucaramanga,Recursos Humanos,2022-10-22,vacante/images/default.jpeg
Amenity horticulturist,Illo accusamus facilis nostrum rem nisi. Ipsum quis reiciendis laudantium enim numquam nulla. Dignissimos dignissimos excepturi commodi officiis vel qui.,Estrategias de Marketing Digital,Manizales,Administración,2022-10-12,vacante/images/default.jpeg
Dispensing optician,"Dolor suscipit qui occaecati ipsa officiis. Architecto nisi dolore corrupti. In quisquam veniam ex ullam.
Veritatis ex est. Quam voluptatibus accusantium odio nihil. Necessitatibus non explicabo ullam quos libero ullam.",Proyectos Empresariales,Bogotá,Investigación,2023-09-05,vacante/images/default.jpeg
"Radiographer, therapeutic","Voluptatum alias occaecati debitis nulla aspernatur ipsum quo. Sunt ipsam quisquam qui.
Dolores tenetur veritatis dignissimos. Nostrum nostrum neque vero.",Consultores Globales,Medellín,Diseño,2023-12-27,vacante/images/default.jpeg
Media planner,Veniam quam repellendus sapiente nemo earum. Recusandae laudantium veritatis. Illo eveniet autem ex maiores pariatur cupiditate. Doloremque vero neque iste.,Grupo Empresarial Latinoamericano,Manizales,Recursos Humanos,2025-01-07,vacante/images/default.jpeg
"Embryologist, clinical","Perferendis quisquam voluptatibus cumque sapiente ipsam necessitatibus. Reiciendis fugiat dignissimos architecto nostrum officia.
Doloremque rem dolor non vitae. Iure tenetur eius sed tempore. Eaque officia deleniti consequuntur fugiat distinctio.",Consultores Globales,Pereira,Investigación,2020-03-08,vacante/images/default.jpeg
"Engineer, aeronautical","Maxime iste molestiae facere eligendi nulla qui. Laborum nam recusandae doloremque consectetur inventore magni.
Ipsa temporibus expedita blanditiis cupiditate cum ullam asperiores. Aut nihil cupiditate laborum.",Fábrica de Software Internacional,Santa Marta,Ventas,2023-03-11,vacante/images/default.jpeg
Marketing executive,"Iste voluptas odio perferendis. Minima in error vel esse asperiores. Maxime vitae quia aut et. Dolor architecto excepturi libero blanditiis sint.
Excepturi deleniti alias. Commodi ab cupiditate voluptas.",Compañía Nacional de Tecnología,Cartagena,Diseño,2021-03-03,vacante/images/default.jpeg
"Engineer, site",Rem labore quae molestias totam ipsam. Accusantium rem totam doloribus eos. Molestiae reprehenderit accusamus nostrum sed.,Consultores Globales,Santa Marta,Diseño,2021-12-01,vacante/images/default.jpeg
"Surveyor, insurance","Temporibus aut ducimus laboriosam officiis repellendus. Minus cumque tempore animi aspernatur dolorum omnis.
Perspiciatis unde blanditiis eos. Optio libero dolorem magnam libero. Quae minus saepe officia aperiam eos.",Compañía Nacional de Tecnología,Medellín,Administración,2023-01-21,vacante/images/default.jpeg
Bonds trader,"Dolor eaque provident doloremque in. Et nihil incidunt quas eum facilis deleniti.
Sunt hic repudiandae natus. Iste neque reiciendis veniam necessitatibus. Eum itaque voluptatibus eaque.",Servicios de Infraestructura TIC,Bogotá,Recursos Humanos,2022-01-12,vacante/images/default.jpeg
Tax inspector,Minus pariatur voluptate cupiditate exercitationem incidunt unde. Qui ab temporibus. Eum sunt at ipsa quod cum assumenda reprehenderit. Commodi quasi magni eum debitis repellendus.,Servicios de Infraestructura TIC,Barranquilla,Ventas,2024-09-16,vacante/images/default.jpeg
Secretary/administrator,"Voluptatem distinctio commodi minus ut officiis. Saepe quam accusamus alias autem optio iure. At molestiae dolore a.
Unde aperiam illo blanditiis. Repellendus dolorem corporis magni quam.
Sed ab quaerat sunt sunt. Porro id voluptatibus sed.",Grupo Empresarial Latinoamericano,Ibagué,Investigación,2022-07-04,vacante/images/default.jpeg
Amenity horticulturist,Dicta aspernatur necessitatibus perspiciatis aspernatur. Adipisci distinctio consequatur consequuntur.,Estrategias de Marketing Digital,Medellín,Investigación,2020-03-31,vacante/images/default.jpeg
Trade union research officer,"Eveniet aut optio perspiciatis quos suscipit ipsa impedit. Molestias nam iusto molestias vero voluptatum corporis ut. Reiciendis qui facere expedita quisquam dolores aspernatur.
Nesciunt asperiores et consectetur ut quibusdam.",Corporación Innovadora,Manizales,Desarrollo,2020-07-13,vacante/images/default.jpeg
Learning disability nurse,"Vero dolores sed deleniti quam. Quibusdam occaecati delectus minus eum pariatur illum. Deleniti cumque id.
Facere voluptatem facere. Illo dicta tempora sequi. Eveniet tempora tempore voluptate rerum vero.",Servicios de Infraestructura TIC,Pereira,Administración,2024-07-30,vacante/images/default.jpeg
Insurance account manager,Itaque quaerat praesentium repellat. Atque numquam nisi fuga atque assumenda expedita beatae. Possimus odio optio molestias voluptate illum cupiditate quis.,Sistemas Digitales S.A.,Cali,Consultoría,2020-10-09,vacante/images/default.jpeg
Product manager,"Deserunt molestias consequatur veritatis qui. Nulla eligendi fuga optio. Rerum veniam expedita voluptatem eligendi.
Debitis porro aliquam fugiat. Sit quod earum repellat est voluptatem. Et unde temporibus ullam cumque possimus.",Estrategias de Marketing Digital,Cali,Diseño,2024-03-18,vacante/images/default.jpeg
Medical secretary,"Quo sequi veritatis minima facilis asperiores pariatur.
Enim modi cumque nihil expedita iusto. Optio molestias occaecati perferendis vitae voluptate. Sit illo optio qui at optio.",Servicios de Infraestructura TIC,Pasto,Recursos Humanos,2022-03-19,vacante/images/default.jpeg
Chief Operating Officer,"Autem expedita atque officia. At optio maiores recusandae quidem.
Temporibus aperiam maiores minus eius deleniti molestiae tempora. Nihil nam nesciunt laudantium maxime impedit.",Grupo Empresarial Latinoamericano,Armenia,Diseño,2022-01-10,vacante/images/default.jpeg
Community development worker,Eveniet tempore dignissimos natus laudantium necessitatibus minus. Voluptatibus excepturi natus soluta consequuntur suscipit. Id maxime sit similique.,Sistemas Digitales S.A.,Santa Marta,Investigación,2021-04-12,vacante/images/default.jpeg
Information systems manager,"Similique eos quod voluptate doloremque. Delectus iste velit nemo voluptatibus ex.
Iure eius eveniet officia. Nesciunt culpa qui non delectus cupiditate.
Velit magni dolorum culpa.",Sistemas Digitales S.A.,Bogotá,Contabilidad,2025-03-12,vacante/images/default.jpeg
"Education officer, museum","Labore est quis nam. Accusamus quisquam rem commodi minus voluptas voluptatibus.
Exercitationem possimus sunt earum magni. Esse similique corrupti id. Dolorem libero officia delectus cumque soluta.",Consultores Globales,Pereira,Desarrollo,2024-08-31,vacante/images/default.jpeg
Broadcast journalist,"Nisi facilis ut nulla. Amet ipsum accusantium voluptatum. Animi modi reiciendis odio itaque. Mollitia quos iure asperiores.
Praesentium maiores reprehenderit voluptatem facere ducimus omnis. Voluptatem eveniet at vel doloribus architecto odit.",Sistemas Digitales S.A.,Neiva,Consultoría,2023-06-17,vacante/images/default.jpeg
Associate Professor,"Omnis magnam id iusto exercitationem. Vel ullam libero amet porro voluptatibus labore debitis. Ut minus soluta ratione.
Cumque ea eveniet et. Tempora deserunt harum voluptatibus voluptatum.",Sistemas Digitales S.A.,Ibagué,Consultoría,2021-02-03,vacante/images/default.jpeg
"Journalist, broadcasting","Laborum distinctio facilis voluptates voluptatibus nostrum quae. Eligendi voluptas quis. Perferendis fugit accusamus.
Itaque exercitationem voluptate quas fugiat. Sed quam perspiciatis et odio magni error. Aperiam neque doloremque ab.",Soluciones Financieras Ltda.,Bucaramanga,Ventas,2021-02-23,vacante/images/default.jpeg
Barrister's clerk,"Accusantium iusto labore veniam.
Eum ipsum aut quo doloribus. Ratione illo nobis placeat minus aliquam laborum.
Veritatis doloremque alias consectetur. Esse temporibus voluptates natus. A amet voluptatem. Necessitatibus architecto vel ipsum.",Grupo Empresarial Latinoamericano,Barranquilla,Recursos Humanos,2024-03-11,vacante/images/default.jpeg
"Development worker, international aid","Mollitia eius sunt officiis voluptate itaque numquam officia. Nam ullam sit repellat sequi aut. Molestias voluptates accusantium accusantium suscipit minima autem.
Distinctio totam beatae. Cumque unde quis ipsa nostrum. Quas rem nulla tenetur.",Compañía Nacional de Tecnología,Medellín,Marketing,2020-06-13,vacante/images/default.jpeg
Architect,"Doloremque architecto occaecati sit dolores. Quod fuga earum dolore mollitia iusto exercitationem.
Numquam ratione ab. Numquam architecto sint quibusdam sit est.",Estrategias de Marketing Digital,Santa Marta,Desarrollo,2021-12-19,vacante/images/default.jpeg
"Teacher, special educational needs",Libero doloremque nisi consectetur nesciunt vero suscipit. Iste adipisci occaecati error. Magnam excepturi voluptatibus provident. Laudantium inventore amet perferendis nostrum incidunt nisi magnam.,Compañía Nacional de Tecnología,Pasto,Desarrollo,2022-09-13,vacante/images/default.jpeg
"Editor, film/video","Facilis commodi exercitationem nulla eaque. Reprehenderit asperiores enim numquam ut.
Iure iure minima iste quasi. Eligendi tenetur asperiores molestiae dignissimos quasi rem.",Proyectos Empresariales,Santa Marta,Marketing,2024-04-10,vacante/images/default.jpeg
Call centre manager,"Repudiandae ipsum quod ad praesentium corporis porro. Debitis in eaque possimus doloremque incidunt.
Fugit temporibus vero dolor sit nihil labore. Quibusdam suscipit et alias molestias impedit.",Compañía Nacional de Tecnología,Barranquilla,Recursos Humanos,2020-12-04,vacante/images/default.jpeg
Public librarian,"Nam libero ex dolores et quasi. Omnis ad quidem nihil.
Aut doloribus consequatur ipsam quis impedit omnis magni.
Sint incidunt modi. Sed animi quod minima exercitationem. Hic praesentium asperiores provident corporis.",Proyectos Empresariales,Neiva,Recursos Humanos,2022-11-03,vacante/images/default.jpeg
"Producer, radio","Accusantium eaque et nihil reprehenderit. A veniam corrupti.
Dolorem officia inventore veritatis. Nostrum nam nesciunt aliquid laboriosam. Cupiditate officia quasi consectetur.",Servicios de Infraestructura TIC,Barranquilla,Contabilidad,2025-02-09,vacante/images/default.jpeg
Accounting technician,Vero odit amet quas. Distinctio optio eaque modi odit optio excepturi. Dolor dolor facilis vel necessitatibus.,Compañía Nacional de Tecnología,Medellín,Administración,2023-03-04,vacante/images/default.jpeg
Maintenance engineer,"Ipsum adipisci natus enim at impedit officiis. Expedita dignissimos nisi alias.
Eius nemo atque inventore doloremque vitae officia. Sit enim sequi quaerat. Quisquam illum at optio alias.",Fábrica de Software Internacional,Cartagena,Soporte Técnico,2021-07-06,vacante/images/default.jpeg
Data scientist,"Voluptate velit distinctio ipsa sed consectetur. Numquam et voluptate impedit blanditiis accusamus.
Ea eius voluptatum adipisci deserunt voluptates aut. Ipsa voluptatibus illum a corrupti cum.",Proyectos Empresariales,Cúcuta,Consultoría,2022-08-23,vacante/images/default.jpeg
Dramatherapist,Eligendi doloribus eos perferendis minima deleniti ipsa. Temporibus perferendis repellendus accusantium rerum doloremque quis.,Consultores Globales,Bogotá,Marketing,2024-08-28,vacante/images/default.jpeg
Operations geologist,"Molestias eveniet suscipit omnis quos. Officia quisquam doloremque.
Possimus sapiente aut distinctio quidem illo error. Ab cupiditate ex consequatur sapiente occaecati. Dolor necessitatibus maxime ab ducimus suscipit explicabo odit.",Proyectos Empresariales,Cali,Consultoría,2021-12-31,vacante/images/default.jpeg
Lexicographer,"Laborum aliquam repellat iusto autem atque hic culpa. Odio commodi ut numquam reiciendis odit. Possimus hic corrupti odio voluptates neque qui debitis.
Magnam minus ut perspiciatis ipsam eaque itaque. Nam nemo commodi mollitia inventore.",Consultores Globales,Pereira,Administración,2021-04-20,vacante/images/default.jpeg
Data processing manager,"Provident fugiat voluptates. Laborum praesentium repudiandae repellendus vitae qui.
Saepe esse rem quibusdam. Culpa iste accusantium aliquam sequi.",Grupo Empresarial Latinoamericano,Pasto,Recursos Humanos,2020-06-06,vacante/images/default.jpeg
Marketing executive,Cum dolores totam laudantium sit quaerat occaecati. Sunt dolore explicabo quam quod molestiae cum minus.,Estrategias de Marketing Digital,Cúcuta,Ventas,2020-01-12,vacante/images/default.jpeg
Comptroller,"In dolores voluptas non amet. Quas odio numquam cupiditate nam aspernatur fugit.
Sint esse maxime possimus dolorum. Nisi quibusdam dolore fugit.",Grupo Empresarial Latinoamericano,Cali,Desarrollo,2020-06-13,vacante/images/default.jpeg
Risk manager,"Dolorum eius pariatur laboriosam ipsa. Delectus optio culpa non molestiae cum sunt odio. Quisquam dolorum praesentium cumque totam doloribus corporis.
Nesciunt corrupti rerum placeat molestias voluptatibus eum iusto.",Corporación Innovadora,Medellín,Consultoría,2022-06-14,vacante/images/default.jpeg
Press photographer,"Beatae quas adipisci fugiat tempore. Quaerat corrupti reiciendis sint voluptas ducimus.
Doloribus accusamus nobis tempora. Maxime dolor dolor consequatur. Quas soluta sequi exercitationem voluptatem iure consequatur facilis.",Proyectos Empresariales,Cúcuta,Consultoría,2020-12-17,vacante/images/default.jpeg
Event organiser,Consectetur quas dolor dolore et. Error veritatis architecto ad repellat laudantium magni. Veniam adipisci sint eius blanditiis voluptatum excepturi quos.,Fábrica de Software Internacional,Manizales,Ventas,2021-04-23,vacante/images/default.jpeg
Chief of Staff,"Provident pariatur quibusdam rem. Rerum quos deserunt nam earum explicabo.
Recusandae natus veniam mollitia. Repudiandae ex maxime pariatur.
Repellendus assumenda quos cum unde. Officiis nesciunt ut facere.",Corporación Innovadora,Bogotá,Diseño,2022-04-02,vacante/images/default.jpeg
Structural engineer,"Inventore porro earum dolores ipsam. Itaque molestias odit. Totam odio tempore ipsum.
Sed commodi quia corporis repellat asperiores. Eaque eius maiores cupiditate unde cum saepe excepturi.",Proyectos Empresariales,Cúcuta,Investigación,2020-06-16,vacante/images/default.jpeg
"Producer, television/film/video",Dolores cum maiores earum atque ipsa. Repellendus porro officiis quisquam sequi illum. Impedit provident tenetur fugiat aut alias. Rerum aliquid necessitatibus quod blanditiis ipsam earum.,Proyectos Empresariales,Cartagena,Consultoría,2022-04-13,vacante/images/default.jpeg
Logistics and distribution manager,"Explicabo totam harum magni. Ex molestiae sequi quis ullam provident incidunt.
Aut non iusto numquam earum nisi. Saepe exercitationem eligendi odit deleniti autem veritatis quaerat.",Fábrica de Software Internacional,Pasto,Administración,2022-10-05,vacante/images/default.jpeg
Insurance account manager,Consequatur animi nihil eos perspiciatis hic distinctio doloremque. Reprehenderit deleniti ad quos laboriosam quas. Possimus ex sint nemo iusto magni.,Soluciones Financieras Ltda.,Armenia,Recursos Humanos,2022-05-20,vacante/images/default.jpeg
Chiropractor,"Nisi numquam odio in expedita. Id maxime odit maxime officiis. Distinctio eligendi aperiam quaerat officia dignissimos.
Et voluptas at laboriosam officia. Culpa facilis sequi maxime quis voluptatum temporibus.",Fábrica de Software Internacional,Manizales,Marketing,2020-09-21,vacante/images/default.jpeg
Chartered public finance accountant,"Eos officia occaecati assumenda labore. Fugit voluptatibus perspiciatis autem. Debitis voluptatum aperiam eum architecto numquam molestiae.
Molestias eum repellendus doloremque iste odio magni.",Proyectos Empresariales,Villavicencio,Marketing,2023-01-08,vacante/images/default.jpeg
"Development worker, community","Saepe libero explicabo consequatur impedit.
Molestiae expedita sint aliquam.
Molestias nisi commodi. Veniam ad commodi quo minus minus.
Neque officia dignissimos. Beatae sint eveniet aliquid totam cumque. Reiciendis vero neque ducimus esse debitis.",Estrategias de Marketing Digital,Bogotá,Contabilidad,2021-03-23,vacante/images/default.jpeg
Higher education lecturer,"Consequuntur tempore molestias. Vel eligendi ut eaque vitae ratione.
Rerum aliquid at illo. Harum nisi at nulla atque dolore earum.
Repellat distinctio libero rem nulla id excepturi illum. Laudantium totam odio doloribus.",Fábrica de Software Internacional,Pasto,Administración,2024-12-11,vacante/images/default.jpeg
Radio broadcast assistant,"Inventore ipsam nam iusto dolores ut. Repellat laborum quod fuga odit minima.
Commodi quis quaerat esse aperiam.
Culpa eveniet quia veniam. Maxime laborum amet repellat debitis. Fuga hic atque repellendus est temporibus impedit.",Servicios de Infraestructura TIC,Cali,Consultoría,2023-07-19,vacante/images/default.jpeg
Environmental education officer,"Voluptatibus molestias vero blanditiis voluptatem. Culpa nemo nemo commodi.
Excepturi iste veniam quos. Mollitia voluptas et quibusdam.
Eos perferendis deleniti quidem. Velit rerum minima consequatur. Totam nostrum minima nam.",Corporación Innovadora,Pasto,Recursos Humanos,2021-08-28,vacante/images/default.jpeg
"Surveyor, building","Enim voluptatibus rem blanditiis. Tempore fuga labore culpa deleniti.
Nihil natus consequuntur similique nam velit. Quod dolorem iusto accusantium eos. In earum hic in cupiditate deserunt.",Sistemas Digitales S.A.,Neiva,Diseño,2021-06-11,vacante/images/default.jpeg
Music tutor,"Tenetur cum iure quaerat rem tempore atque. Vero incidunt iure non aliquam tempora.
Modi dolores eveniet veritatis iste neque incidunt aut.",Corporación Innovadora,Cartagena,Ventas,2020-05-10,vacante/images/default.jpeg
Insurance risk surveyor,"Sint facere quos totam deserunt. Natus fugiat eveniet expedita. Tenetur sunt soluta atque.
Aspernatur blanditiis aspernatur. Cum aliquam molestiae possimus voluptates asperiores quaerat deleniti. Sit facilis illum in doloribus veritatis nihil quos.",Grupo Empresarial Latinoamericano,Cali,Ventas,2020-04-27,vacante/images/default.jpeg
Artist,"Veniam commodi eum velit. Consectetur placeat fuga culpa unde. Suscipit impedit velit repellendus.
Aut similique facilis nostrum ad modi. Eius officiis totam non illum quisquam beatae nam.",Grupo Empresarial Latinoamericano,Medellín,Administración,2020-02-19,vacante/images/default.jpeg
Chartered legal executive (England and Wales),Nulla mollitia doloribus ullam. Expedita tenetur libero nihil deserunt inventore. Vero reiciendis omnis alias dolorem. Animi pariatur ipsa esse perspiciatis id distinctio aperiam.,Consultores Globales,Medellín,Diseño,2023-08-18,vacante/images/default.jpeg
Medical technical officer,"Quaerat quos molestiae harum. Minus qui doloremque vitae deleniti autem mollitia.
Deleniti autem ex earum. Ullam aut repellat atque. Sapiente iste neque esse dolorem.",Grupo Empresarial Latinoamericano,Bucaramanga,Recursos Humanos,2023-12-24,vacante/images/default.jpeg
Mechanical engineer,"Laborum magnam iste culpa dolor. Ipsa aperiam minus blanditiis reprehenderit. Eaque ipsam incidunt veniam.
Dignissimos distinctio quas repudiandae consectetur illo. Voluptatem blanditiis occaecati fuga repudiandae dignissimos.",Soluciones Financieras Ltda.,Cúcuta,Desarrollo,2022-12-29,vacante/images/default.jpeg
"Surveyor, quantity","Nam beatae cumque optio reiciendis harum. Labore praesentium ducimus placeat vitae. Illum temporibus id cum.
Maiores quo ipsum saepe ipsam quae explicabo. Similique rerum optio odit sit nobis eligendi adipisci. Odit odio velit rem enim.",Proyectos Empresariales,Santa Marta,Investigación,2024-10-23,vacante/images/default.jpeg
"Exhibitions officer, museum/gallery",Beatae iste ad porro vero quo animi. Labore veritatis enim repudiandae eum assumenda. Qui ex libero inventore similique nostrum.,Grupo Empresarial Latinoamericano,Cúcuta,Recursos Humanos,2020-08-04,vacante/images/default.jpeg
Commercial art gallery manager,"Sunt odit consequuntur non nam. Animi maxime numquam adipisci vero.
Magnam laborum doloribus. Sed repellendus dolorum. Sint fuga laborum perferendis consequuntur facere eaque.",Compañía Nacional de Tecnología,Villavicencio,Diseño,2024-08-06,vacante/images/default.jpeg
"Designer, exhibition/display","Eligendi accusantium in. Ipsa porro aliquid corrupti minus delectus nihil.
Illum ipsum assumenda consequuntur repellat. A ipsa sint id nesciunt. Omnis dolores eius quisquam reprehenderit laudantium nam. Voluptatum provident voluptatum et.",Soluciones Financieras Ltda.,Bogotá,Diseño,2021-02-24,vacante/images/default.jpeg
