title,description,company,location,area,date,image
Public house manager,"Id saepe consequatur iste aliquid. Modi ipsum quam nemo.
Molestias commodi fugiat nostrum. Suscipit laborum est perferendis exercitationem adipisci eligendi. Pariatur assumenda consequatur officia explicabo enim.",Servicios de Infraestructura TIC,Villavicencio,Recursos Humanos,2020-01-21,vacante/images/default.jpeg
"Production assistant, radio","Consectetur eaque repellat exercitationem deserunt exercitationem.
Repudiandae molestiae minima voluptatem. Velit magnam sunt libero ipsum vero.",Sistemas Digitales S.A.,Pereira,Administración,2020-10-18,vacante/images/default.jpeg
"Programmer, applications","Inventore ipsam excepturi laboriosam quasi modi quae perferendis. Nam delectus alias eligendi inventore sunt.
Voluptatem earum saepe cupiditate. Neque velit deleniti.",Grupo Empresarial Latinoamericano,Barranquilla,Diseño,2020-03-01,vacante/images/default.jpeg
"Engineer, aeronautical","Tenetur eos libero. Eligendi hic ullam tempore velit.
Debitis ab ex incidunt sed maxime. Provident aliquid corporis cumque sint.
Tenetur corporis cupiditate ipsa. Debitis ullam saepe tempore sapiente nulla.",Proyectos Empresariales,Neiva,Desarrollo,2025-02-05,vacante/images/default.jpeg
Environmental consultant,"Voluptatibus aliquid exercitationem distinctio nemo ullam inventore. Aspernatur veritatis voluptatem.
Dolore asperiores et.
Nesciunt quas labore in excepturi reprehenderit qui. Impedit necessitatibus unde explicabo cumque libero occaecati.",Corporación Innovadora,Manizales,Recursos Humanos,2021-12-04,vacante/images/default.jpeg
Bonds trader,"Eos ipsa ab reprehenderit. Saepe est quaerat ullam sed eligendi ducimus. Eligendi minus quos voluptas suscipit.
Ex perferendis tempora accusantium deleniti quia. Quo illo aperiam. Eaque cum doloribus odit assumenda.",Proyectos Empresariales,Medellín,Contabilidad,2022-04-29,vacante/images/default.jpeg
Higher education careers adviser,Aperiam dolore quae sint repudiandae tenetur. Itaque iure architecto eius aut adipisci consequuntur veritatis. Atque assumenda rerum ratione.,Consultores Globales,Pereira,Diseño,2024-12-25,vacante/images/default.jpeg
Tourism officer,"Fugit doloribus sunt temporibus aut molestiae placeat. Sit assumenda voluptatem quo.
Deleniti unde provident esse. Quis atque minus earum rem numquam fugit.",Sistemas Digitales S.A.,Armenia,Ventas,2024-04-20,vacante/images/default.jpeg
"Psychologist, clinical","Assumenda eius possimus occaecati recusandae voluptates quasi. Maiores sit porro facilis. Ipsum quibusdam ad deleniti tempore voluptatibus.
Repellendus eveniet non eveniet fugiat. Dolor expedita non. Ea soluta atque quasi sequi.",Servicios de Infraestructura TIC,Armenia,Diseño,2021-03-27,vacante/images/default.jpeg
Pension scheme manager,Atque explicabo voluptate iste cupiditate similique. Tempora eos dolorem in. Inventore praesentium error.,Proyectos Empresariales,Pereira,Marketing,2021-10-08,vacante/images/default.jpeg
Automotive engineer,"Rerum velit excepturi omnis blanditiis.
Officiis quae asperiores quo. Unde accusantium perspiciatis unde repellendus. Aspernatur eum alias fugiat soluta dolore.
Voluptas provident quis aut quas. Nulla porro ad inventore.",Proyectos Empresariales,Villavicencio,Marketing,2020-07-30,vacante/images/default.jpeg
"Teacher, English as a foreign language",Porro excepturi laborum porro cumque veritatis. Repellendus temporibus occaecati quo.,Corporación Innovadora,Villavicencio,Recursos Humanos,2020-10-27,vacante/images/default.jpeg
Translator,"Quae dolore optio autem id tempora. Modi qui laboriosam optio nihil incidunt quisquam modi. Omnis in voluptate quia vitae voluptatum.
Incidunt ipsum eveniet. Ipsum eum rem.",Consultores Globales,Pereira,Diseño,2024-02-08,vacante/images/default.jpeg
Speech and language therapist,Aperiam odit quasi expedita sapiente placeat atque. Perspiciatis nostrum corrupti aut aspernatur pariatur. Voluptate delectus debitis ex incidunt temporibus ullam neque.,Servicios de Infraestructura TIC,Bogotá,Desarrollo,2023-05-09,vacante/images/default.jpeg
"Engineer, aeronautical","Aperiam vitae quos temporibus. Est quaerat fuga illum omnis rerum ea animi.
Facere expedita labore quidem adipisci reprehenderit adipisci. Quas quod voluptatibus perferendis.
Iusto ducimus nemo soluta. Provident ad doloribus aliquid nisi.",Corporación Innovadora,Manizales,Investigación,2023-02-04,vacante/images/default.jpeg
Estate agent,"Earum autem quos inventore dolorum tenetur similique.
Qui nobis similique provident repellat sint soluta mollitia. Temporibus molestiae libero in. Ut placeat iure soluta facilis.",Consultores Globales,Santa Marta,Consultoría,2023-12-13,vacante/images/default.jpeg
Veterinary surgeon,"In officia dolorem temporibus. Vel tenetur aut pariatur assumenda facere quaerat. Assumenda consequuntur odit repudiandae.
Nostrum voluptas quis voluptates. Hic iure eligendi voluptatum.",Servicios de Infraestructura TIC,Pereira,Marketing,2022-07-28,vacante/images/default.jpeg
Soil scientist,"Similique soluta beatae placeat earum blanditiis occaecati. Ipsam ipsa itaque molestias modi quas porro mollitia.
Dicta optio eaque libero. Inventore quo magni necessitatibus. Nisi maxime facilis labore.",Compañía Nacional de Tecnología,Cali,Recursos Humanos,2023-03-26,vacante/images/default.jpeg
Immigration officer,Sed autem explicabo consequuntur doloribus adipisci sapiente. Nobis optio nobis. Delectus ullam magni cum repudiandae dignissimos.,Fábrica de Software Internacional,Neiva,Diseño,2023-08-29,vacante/images/default.jpeg
Estate manager/land agent,"Sit debitis veniam nihil magnam. Eum officia temporibus. Sed nihil eius amet.
Modi officia nesciunt nemo magni. Fugiat vitae quisquam dolor maiores quisquam incidunt. Numquam possimus vero illum odit accusantium hic.",Soluciones Financieras Ltda.,Pasto,Soporte Técnico,2024-04-17,vacante/images/default.jpeg
"Psychotherapist, dance movement","Placeat nemo ad distinctio sequi. Iste alias quae aspernatur.
Ea cumque occaecati vitae quo. Ea aliquid ullam numquam labore accusantium nemo. Eum aliquid deserunt dicta atque.",Corporación Innovadora,Ibagué,Diseño,2025-02-28,vacante/images/default.jpeg
Osteopath,"Magni iste autem a placeat. Accusantium reiciendis error voluptate fuga quod.
Dignissimos voluptates quia in ullam officia. Doloremque cupiditate sapiente reiciendis animi ullam. Accusantium aspernatur ipsam sunt quos dolorem quia.",Corporación Innovadora,Ibagué,Ventas,2022-12-01,vacante/images/default.jpeg
Video editor,"Eligendi perspiciatis expedita officia. Natus inventore natus voluptatibus soluta facilis provident voluptatum. Voluptate beatae enim natus labore quos et alias.
Neque nihil officia ullam similique.
Incidunt consequatur saepe provident amet.",Servicios de Infraestructura TIC,Cali,Diseño,2021-11-23,vacante/images/default.jpeg
"Engineer, energy","Tempore id minima perferendis. Fugit officiis blanditiis recusandae maxime id. Perspiciatis nemo fugit enim. Ut voluptas nostrum ab dolore dolorum animi.
Voluptate cupiditate accusantium ab harum minus.",Soluciones Financieras Ltda.,Barranquilla,Consultoría,2022-06-18,vacante/images/default.jpeg
Freight forwarder,"Repudiandae a fugit voluptatum iure nulla laborum. Sint non quam rem facere voluptatibus. Error autem facilis consectetur vitae temporibus maiores.
Corrupti ipsum temporibus perspiciatis ullam ipsum inventore.",Corporación Innovadora,Pereira,Ventas,2024-08-25,vacante/images/default.jpeg
Hotel manager,"Amet similique fuga vitae quae assumenda dicta. Veritatis quisquam esse nam explicabo in accusamus.
Sint reprehenderit dolorem sed debitis placeat. Voluptatibus rerum amet recusandae asperiores laboriosam.",Servicios de Infraestructura TIC,Barranquilla,Consultoría,2023-12-15,vacante/images/default.jpeg
Gaffer,"Quisquam similique tenetur voluptates mollitia nobis.
Voluptatum aperiam omnis vitae aliquid sint natus. Id possimus odit blanditiis doloribus.
Veniam cupiditate alias esse nemo. Voluptates a fuga iure nulla molestiae cumque.",Estrategias de Marketing Digital,Pereira,Ventas,2020-10-20,vacante/images/default.jpeg
Community arts worker,"Dolorem cumque laboriosam repellat. Sit sequi quasi corrupti enim laboriosam. Expedita quam iusto voluptatem debitis incidunt veniam.
Consectetur nesciunt et. Earum in iusto cumque nobis harum delectus.",Estrategias de Marketing Digital,Cúcuta,Administración,2022-08-15,vacante/images/default.jpeg
"Embryologist, clinical","Iusto ullam in cum itaque debitis adipisci placeat. Culpa molestiae recusandae inventore nesciunt eius. Ut at assumenda.
Quas nemo nesciunt tempore porro harum. Quo neque eveniet corporis dicta asperiores omnis inventore.",Sistemas Digitales S.A.,Bucaramanga,Contabilidad,2022-08-21,vacante/images/default.jpeg
Hospital pharmacist,"Accusamus ea asperiores magni. Necessitatibus tenetur cum vitae earum exercitationem similique. Suscipit corrupti nemo quod.
Impedit assumenda quam reiciendis dicta exercitationem consequatur consequuntur. Tempore iste asperiores hic in optio.",Grupo Empresarial Latinoamericano,Santa Marta,Recursos Humanos,2020-12-12,vacante/images/default.jpeg
Data scientist,"Accusamus animi beatae eum accusamus.
Facilis placeat aspernatur ratione. Ex perferendis aperiam inventore.",Proyectos Empresariales,Cúcuta,Soporte Técnico,2021-11-09,vacante/images/default.jpeg
Building surveyor,Reiciendis eos animi saepe occaecati ipsam doloribus. Deleniti alias impedit enim vel aperiam. Ipsam placeat tempore. Praesentium sint perferendis exercitationem officia sequi similique.,Soluciones Financieras Ltda.,Ibagué,Contabilidad,2024-09-02,vacante/images/default.jpeg
Training and development officer,"Omnis ducimus labore sint consequatur. Cupiditate ipsum dolorem provident asperiores.
Corrupti quod quae libero vel animi. Commodi amet et adipisci. Quidem velit quod.",Estrategias de Marketing Digital,Medellín,Administración,2021-11-27,vacante/images/default.jpeg
Field seismologist,Deleniti facere sunt ad amet ducimus. Odio nobis aspernatur qui molestias. Ab voluptates ipsa illum eos labore laborum.,Compañía Nacional de Tecnología,Armenia,Soporte Técnico,2023-12-18,vacante/images/default.jpeg
"Scientist, water quality","Dolores rerum sed harum fugit facilis consequatur perspiciatis. Exercitationem rem saepe culpa porro excepturi omnis.
Possimus modi nemo commodi nobis tempore labore veniam. Suscipit dolorem fugiat. Ducimus cupiditate delectus non ea.",Corporación Innovadora,Medellín,Ventas,2022-04-27,vacante/images/default.jpeg
"Accountant, chartered public finance",Praesentium explicabo at maiores beatae iure quam iste. Eum porro sapiente illo delectus veritatis nam veritatis. Explicabo vero officia eveniet culpa optio.,Compañía Nacional de Tecnología,Cartagena,Diseño,2021-08-31,vacante/images/default.jpeg
Leisure centre manager,"Numquam quos ullam tempora repellat odit ipsum optio. Quas non illo consequuntur a illum assumenda. Distinctio libero totam nostrum odit expedita recusandae.
Corporis expedita expedita optio magni quaerat beatae. Dolor ab est aut voluptatibus.",Compañía Nacional de Tecnología,Medellín,Ventas,2023-02-25,vacante/images/default.jpeg
Exercise physiologist,"Qui quasi velit doloribus. Sint doloremque placeat.
Nam sed alias atque. In excepturi modi deserunt.
Iusto vel delectus nemo aut perspiciatis. Voluptatem adipisci expedita laborum necessitatibus. Mollitia animi possimus veniam iste esse ad.",Compañía Nacional de Tecnología,Armenia,Administración,2022-08-11,vacante/images/default.jpeg
Adult guidance worker,"Autem maxime provident voluptatibus nostrum. Illum nulla alias nihil saepe. Voluptatibus fuga similique saepe eos magnam.
Doloribus nesciunt nisi minus eveniet perferendis. Voluptates ipsam reiciendis sequi quod.",Compañía Nacional de Tecnología,Armenia,Administración,2020-11-15,vacante/images/default.jpeg
Technical sales engineer,"Deleniti iusto recusandae dolores ullam at. Eligendi repellat accusamus assumenda maiores corporis. Vel repudiandae repellat deserunt voluptates quas.
Provident maiores saepe eos. Quis vel a quisquam cum.",Soluciones Financieras Ltda.,Manizales,Contabilidad,2022-01-14,vacante/images/default.jpeg
"Producer, television/film/video","Est ad iure adipisci totam. Error suscipit ab non accusantium reprehenderit.
Autem quae voluptatum itaque velit id culpa. Velit eos fugit corporis officia est quam iste.",Estrategias de Marketing Digital,Villavicencio,Ventas,2020-05-23,vacante/images/default.jpeg
Ergonomist,"Amet laborum aliquam facere tempore earum illum. Alias nesciunt ad adipisci est doloremque deserunt facilis.
Soluta quasi eos quisquam neque itaque eius. Necessitatibus atque vitae odio fugiat similique. Aperiam deserunt ipsam.",Proyectos Empresariales,Ibagué,Contabilidad,2024-10-15,vacante/images/default.jpeg
Armed forces technical officer,"Saepe illum perspiciatis at architecto ipsum nemo. Commodi blanditiis eaque. Nihil fuga reprehenderit fugiat.
Consequuntur ab dicta magni eius. Libero maxime qui.",Proyectos Empresariales,Manizales,Administración,2022-05-13,vacante/images/default.jpeg
Chartered management accountant,"Omnis nulla nobis provident dicta consectetur. Consectetur dolorem illum. Laudantium repellendus praesentium quia ducimus voluptatem necessitatibus.
Non quo eius doloribus. Eius debitis facilis quod totam provident.",Compañía Nacional de Tecnología,Armenia,Contabilidad,2022-01-15,vacante/images/default.jpeg
Ambulance person,"Neque nemo quasi voluptas. Eveniet enim neque quas.
Ab nam cupiditate voluptate facilis quaerat sequi. Reprehenderit cumque sequi asperiores culpa eius. Temporibus quam rerum eveniet tempore.",Corporación Innovadora,Villavicencio,Desarrollo,2021-06-16,vacante/images/default.jpeg
"Surveyor, planning and development","Laborum voluptatum magnam a quas.
Aut est aperiam officia. Error omnis qui tempora accusamus ut deserunt.
Sunt molestias laboriosam error minus distinctio.",Proyectos Empresariales,Medellín,Ventas,2022-06-09,vacante/images/default.jpeg
Industrial buyer,"Cumque officia quam. Illo sequi saepe vitae quas impedit eaque.
Assumenda voluptatum facilis id ab eum. Rem tempora nulla sequi sit excepturi.
Debitis ducimus hic quod excepturi in. Dolores possimus asperiores ab facere voluptatum itaque deleniti.",Proyectos Empresariales,Armenia,Contabilidad,2024-10-10,vacante/images/default.jpeg
Clinical molecular geneticist,"Libero corrupti aliquam aliquid architecto soluta. Nulla reiciendis harum hic.
Corporis ipsam optio minima. Nam explicabo blanditiis nulla quisquam. Repellat doloremque mollitia rem accusantium consequuntur.",Soluciones Financieras Ltda.,Santa Marta,Marketing,2021-08-18,vacante/images/default.jpeg
Herbalist,"Officiis odio quis animi sunt reiciendis. Quas quasi voluptatem quidem libero eveniet.
Maiores tenetur molestiae ratione. Blanditiis quod animi sit soluta minima.",Proyectos Empresariales,Villavicencio,Recursos Humanos,2023-06-29,vacante/images/default.jpeg
Chief of Staff,"Nesciunt veritatis tempora omnis repellat aperiam nihil.
Aut nemo exercitationem totam expedita mollitia incidunt. Illum tempore aut magnam porro.",Grupo Empresarial Latinoamericano,Bogotá,Marketing,2023-04-23,vacante/images/default.jpeg
Chief Financial Officer,"Id enim quidem sit doloremque sapiente. Vel dolores ipsum reiciendis officia consequuntur inventore.
Aut exercitationem quibusdam ex. Laudantium amet nobis voluptatibus repellendus architecto necessitatibus. Blanditiis dicta quibusdam labore.",Grupo Empresarial Latinoamericano,Manizales,Diseño,2022-12-15,vacante/images/default.jpeg
Public house manager,Eum reprehenderit voluptate laborum porro laborum dolor. Sunt eaque beatae voluptatibus accusantium delectus debitis. Veritatis dignissimos commodi. Repellendus eveniet ducimus repudiandae culpa.,Soluciones Financieras Ltda.,Pasto,Desarrollo,2023-11-28,vacante/images/default.jpeg
Cabin crew,"Voluptatum impedit rem fugiat nobis. Ipsum blanditiis voluptas sequi aliquam repellendus. Suscipit ex temporibus animi voluptas quae. Molestias quibusdam facere.
Officiis nulla assumenda quaerat. Deserunt minus excepturi quae illo.",Soluciones Financieras Ltda.,Ibagué,Diseño,2024-05-05,vacante/images/default.jpeg
Financial manager,"Voluptatum nihil dolore eaque. Odio laudantium temporibus occaecati mollitia ipsa. A voluptates expedita debitis hic deleniti.
Nisi molestias quibusdam harum nam officiis. Quidem vel ipsam quae velit illum. Deleniti maiores explicabo error.",Consultores Globales,Neiva,Marketing,2023-05-06,vacante/images/default.jpeg
Midwife,"Possimus unde modi voluptatibus corrupti modi. Eos animi molestiae deserunt sint dicta maiores. Incidunt possimus dolore enim necessitatibus repellat et.
Ipsam explicabo pariatur. Quae exercitationem ipsum laboriosam. Veniam optio et eligendi quia.",Grupo Empresarial Latinoamericano,Santa Marta,Soporte Técnico,2022-07-25,vacante/images/default.jpeg
Quality manager,"Dicta ipsa necessitatibus veniam qui ea quia eligendi. Nisi porro aliquid temporibus expedita deleniti. Eveniet consequatur nobis quisquam dolorem voluptatibus.
In necessitatibus est accusamus officiis. Atque pariatur et at quasi.",Consultores Globales,Medellín,Recursos Humanos,2025-02-22,vacante/images/default.jpeg
"Pharmacist, community","Excepturi iusto pariatur at. Sapiente a dolor modi consequuntur et.
Totam quasi impedit. Nemo deleniti quos a quasi.
Aliquid magnam dolores sapiente excepturi. At iure est natus impedit expedita nulla nemo. Dolorem facere ipsum odio voluptatem at.",Compañía Nacional de Tecnología,Medellín,Recursos Humanos,2024-12-27,vacante/images/default.jpeg
Scientific laboratory technician,"Sequi est illo quaerat natus.
Error illum nostrum corrupti ab sapiente. Magni autem itaque repellat fugiat alias magni.
Id consequatur sunt natus a. Exercitationem vero corrupti totam quibusdam.",Consultores Globales,Cartagena,Contabilidad,2024-03-20,vacante/images/default.jpeg
Copy,"Sit non officiis ea quos enim explicabo. Ea libero provident quasi. Facere ex sapiente alias laborum soluta.
Officia quas natus blanditiis. Eaque eum et omnis dolorem.
Veniam consectetur magnam necessitatibus non dignissimos. Nisi dolor minima quos.",Fábrica de Software Internacional,Villavicencio,Investigación,2023-10-08,vacante/images/default.jpeg
"Geologist, wellsite","Officia quasi perspiciatis id. Quas voluptatibus quidem perferendis reprehenderit quae.
Nam nam qui consequatur delectus. Laboriosam iure doloremque reiciendis. Corporis vitae similique commodi velit.",Corporación Innovadora,Cali,Marketing,2022-09-23,vacante/images/default.jpeg
Radiation protection practitioner,"Illo quidem in ducimus. Vero officiis velit error cumque quasi et. Possimus ullam amet quam.
Odit nostrum consequatur optio tenetur laborum.
Iusto dignissimos qui possimus deleniti. Minus rem excepturi eaque fugit eius alias.",Grupo Empresarial Latinoamericano,Ibagué,Administración,2023-09-18,vacante/images/default.jpeg
Musician,"Libero voluptates cumque deleniti. Quo doloribus architecto tenetur. Nulla doloremque fugiat sequi.
Beatae enim ratione. Quasi repudiandae voluptate. In velit quidem excepturi laborum repellat maiores.",Corporación Innovadora,Santa Marta,Investigación,2025-01-05,vacante/images/default.jpeg
Writer,"Ab odit tempore saepe exercitationem rerum. Soluta eligendi dolorum corporis et vero.
Dicta repellendus pariatur neque. Voluptate dolorum aperiam ad modi. Voluptatem non ratione voluptatem.",Grupo Empresarial Latinoamericano,Santa Marta,Administración,2023-03-27,vacante/images/default.jpeg
"Designer, television/film set","Incidunt rem fugiat dolor blanditiis doloribus quam. Quisquam iusto quia officia eius dolore.
Beatae enim a debitis. Magnam ab delectus eum. Dignissimos earum suscipit.
Cum rerum iure repellat explicabo.",Estrategias de Marketing Digital,Neiva,Recursos Humanos,2023-08-18,vacante/images/default.jpeg
Planning and development surveyor,Laboriosam asperiores blanditiis magni impedit reprehenderit possimus. Ad odit nemo in. Amet explicabo nostrum quod consequatur architecto.,Soluciones Financieras Ltda.,Cúcuta,Diseño,2020-09-02,vacante/images/default.jpeg
"Designer, furniture","Esse voluptate expedita. Saepe perspiciatis optio accusantium atque pariatur.
Unde repellendus unde nemo. Deleniti optio tenetur repellat corrupti amet. Beatae possimus deserunt aperiam.
Fugit veritatis aut repudiandae.",Sistemas Digitales S.A.,Bucaramanga,Administración,2020-09-03,vacante/images/default.jpeg
Building control surveyor,"Magni inventore nam beatae atque voluptatibus. Recusandae praesentium quisquam reprehenderit suscipit animi fugit.
Neque tempora quasi repellendus illo fugiat voluptatibus cupiditate. Eos unde excepturi vitae praesentium temporibus ex.",Grupo Empresarial Latinoamericano,Cali,Ventas,2021-10-16,vacante/images/default.jpeg
Logistics and distribution manager,"Ex beatae dolor nobis minus et repudiandae similique. Et animi nemo quos praesentium repudiandae deleniti placeat. Quas dolorem voluptas voluptate provident eius.
Inventore vero magni voluptates officiis repellat rerum.",Soluciones Financieras Ltda.,Bucaramanga,Recursos Humanos,2023-11-28,vacante/images/default.jpeg
Claims inspector/assessor,Repellat dolorum minima eligendi quia officia cupiditate. Sunt libero dicta ea cum. Aliquam pariatur laudantium labore error. Ipsam modi eaque non sunt laudantium.,Estrategias de Marketing Digital,Medellín,Investigación,2024-12-29,vacante/images/default.jpeg
"Librarian, public","Ducimus voluptate magnam reprehenderit itaque. Id quia amet quae. Possimus eius tempora minima sed.
Aliquam corporis soluta voluptatibus quidem voluptas. Velit quod adipisci dolorem.",Soluciones Financieras Ltda.,Pereira,Investigación,2021-12-03,vacante/images/default.jpeg
Brewing technologist,"Illo suscipit ut nulla voluptates. Sequi corporis eius dolorum iure.
Dolorum eveniet quas voluptatem. Ullam natus error molestias. Et asperiores fugit dolor ea.",Grupo Empresarial Latinoamericano,Santa Marta,Administración,2023-08-07,vacante/images/default.jpeg
Osteopath,Aliquid voluptatum veritatis ipsam ut. Dolores veniam fugiat assumenda possimus aliquam excepturi possimus. Veniam enim veniam placeat. Excepturi non veniam maxime molestiae nesciunt.,Compañía Nacional de Tecnología,Santa Marta,Ventas,2023-10-29,vacante/images/default.jpeg
Animal nutritionist,Quibusdam nobis molestias voluptatum. Blanditiis repudiandae mollitia vel nemo minus ad.,Sistemas Digitales S.A.,Neiva,Diseño,2022-04-13,vacante/images/default.jpeg
Accounting technician,Facere sit corporis provident dolorem beatae adipisci sint. Laboriosam iure reprehenderit sequi iusto deserunt. Accusamus quae consectetur exercitationem.,Grupo Empresarial Latinoamericano,Cali,Soporte Técnico,2021-04-14,vacante/images/default.jpeg
Music tutor,"Quasi iure consectetur culpa doloremque. Consectetur commodi rerum fugiat incidunt corrupti impedit.
Eum excepturi ad incidunt. Corrupti maxime ex sed. Totam repellat excepturi unde optio corporis quidem dolorum.",Fábrica de Software Internacional,Bogotá,Consultoría,2023-10-18,vacante/images/default.jpeg
"Engineer, technical sales","Necessitatibus repellendus eum minus. Alias sit ex voluptate perspiciatis animi provident. Unde molestias molestiae unde aut.
A facilis sed adipisci. Qui cupiditate placeat esse maxime corrupti.",Soluciones Financieras Ltda.,Medellín,Soporte Técnico,2020-10-13,vacante/images/default.jpeg
Orthoptist,"Qui accusantium temporibus nemo minus aliquam perferendis. Quo vitae adipisci impedit dolorum quaerat. Eius dolores incidunt voluptatibus.
Vitae hic illo illo minus. Debitis aperiam repudiandae. Totam eaque magni.",Grupo Empresarial Latinoamericano,Ibagué,Investigación,2021-09-28,vacante/images/default.jpeg
Furniture conservator/restorer,"Libero debitis officiis deserunt sint atque. Consectetur cumque saepe consectetur vitae nam magni error. Sint culpa fugiat at.
Excepturi perferendis laboriosam laboriosam aspernatur consequuntur. Quaerat libero error ad molestias nulla explicabo.",Soluciones Financieras Ltda.,Medellín,Desarrollo,2020-06-23,vacante/images/default.jpeg
"Scientist, water quality","Nisi quidem asperiores sequi. Possimus cupiditate hic minima.
Quo autem sint velit veritatis aliquam. Perspiciatis hic dicta eius tenetur nam facilis. Perspiciatis odit adipisci voluptatibus ut sapiente suscipit.",Corporación Innovadora,Medellín,Consultoría,2023-11-14,vacante/images/default.jpeg
Games developer,"Necessitatibus tempora assumenda quo reprehenderit maxime aliquam. Voluptatibus exercitationem minus quo possimus explicabo culpa. Sapiente dolorem culpa fugiat corrupti temporibus.
Esse eum minima sunt.",Soluciones Financieras Ltda.,Pasto,Ventas,2021-07-09,vacante/images/default.jpeg
"Designer, textile","Dolor doloremque ab ea eligendi architecto ad qui. Similique dignissimos magni accusantium sunt nulla amet quisquam. Officia totam error temporibus.
Nostrum totam qui veniam. Quibusdam ad aut id necessitatibus aut voluptatibus.",Fábrica de Software Internacional,Bogotá,Marketing,2025-03-05,vacante/images/default.jpeg
Site engineer,"Autem corporis repellendus accusantium dolores. Officiis non modi alias laborum cupiditate sit libero.
Minus error sunt iusto reiciendis.",Sistemas Digitales S.A.,Medellín,Desarrollo,2023-09-20,vacante/images/default.jpeg
Training and development officer,Nam quae saepe dolorum ea nemo similique. Odio reiciendis pariatur et. Maiores sed sunt minima culpa beatae.,Soluciones Financieras Ltda.,Bogotá,Ventas,2023-07-04,vacante/images/default.jpeg
"Geneticist, molecular","Suscipit necessitatibus cumque cumque at. Ad maxime aliquam illo.
Quo amet fugit doloribus assumenda recusandae. Accusamus sint similique quaerat quidem quas ipsam.
Ex aliquam libero non necessitatibus natus tenetur. Esse tempore occaecati debitis.",Estrategias de Marketing Digital,Villavicencio,Consultoría,2022-05-20,vacante/images/default.jpeg
